{
    "class_name": "InterMsgExample",
    "filename": "interMsgExample",
    "description": "Example inter-message structure for communication",
    "msg_id": "Example",
    "send_type": "UnicastWithControl",
    "fields": [
        {
            "name": "exampleData",
            "type": "uint32_t",
            "description": "Example data for the message"
        },
        {
            "name": "exampleString",
            "type": "char[]",
            "size": 256,
            "description": "Example string for the message"
        }
    ]
}
